{
  "version": 2,
  "name": "抹茶山（聖母山莊步道）",
  "center": [24.840, 121.743],
  "zoom": 14,
  "spots": [
    { "id": "s1", "latlng": [24.8295, 121.7525], "num": 1, "title": "五峰旗停車場", "desc": "步道起點，有廁所和飲水機", "photo": null, "iconId": "parking", "cardOffset": { "x": 80, "y": -50 } },
    { "id": "s2", "latlng": [24.8335, 121.7482], "num": 2, "title": "聖母朝聖地", "desc": "天主教堂，最後補水點", "photo": null, "iconId": "water", "cardOffset": { "x": -110, "y": -40 } },
    { "id": "s3", "latlng": [24.8405, 121.7412], "num": 3, "title": "通天橋", "desc": "真正登山口，陡升 1.6km 開始", "photo": null, "iconId": "warning", "cardOffset": { "x": 90, "y": -70 } },
    { "id": "s4", "latlng": [24.8490, 121.7325], "num": 4, "title": "抹茶山觀景台", "desc": "IG 打卡聖地，俯瞰蘭陽平原和龜山島", "photo": null, "iconId": "camera", "cardOffset": { "x": -100, "y": -80 } },
    { "id": "s5", "latlng": [24.8502, 121.7318], "num": 5, "title": "三角崙山", "desc": "台灣小百岳，海拔 1,029m", "photo": null, "iconId": "rock", "cardOffset": { "x": 70, "y": -50 } }
  ],
  "routes": [
    {
      "id": "r1",
      "name": "聖母山莊步道",
      "pts": [
        [24.8295, 121.7525], [24.8305, 121.7512], [24.8318, 121.7498],
        [24.8335, 121.7482], [24.8355, 121.7460], [24.8380, 121.7438],
        [24.8405, 121.7412], [24.8428, 121.7390], [24.8450, 121.7368],
        [24.8468, 121.7348], [24.8485, 121.7330], [24.8502, 121.7318]
      ],
      "color": "green",
      "elevations": [180, 220, 260, 300, 400, 500, 600, 700, 780, 860, 950, 1029]
    }
  ]
}
