{
  "version": 2,
  "name": "巴克禮牧師台灣宣教足跡 1875-1935",
  "center": [
    22.993,
    120.205
  ],
  "zoom": 13,
  "spots": [
    {
      "id": "s1",
      "latlng": [
        22.6126,
        120.2654
      ],
      "num": 1,
      "title": "旗後教會（打狗登陸地）",
      "desc": "1875年6月5日，26歲的巴克禮從蘇格蘭搭船抵達打狗港（今高雄旗津），成為英國長老教會第5位來台宣教師。他在旗後住了一年半，於住宅樓下教導學生，繼承馬雅各醫生1865年創設的打狗禮拜堂事工。旗後教會是台灣第一間基督長老教會禮拜堂，1935年改建為仿羅馬式建築，2013年再修建為七層哥德式尖頂教堂。",
      "photo": "/stories/taiwan-missionaries/spot-photos/cf27a0a8258c683c.jpg",
      "iconId": "default",
      "cardOffset": {
        "x": 90,
        "y": -60
      }
    },
    {
      "id": "s2",
      "latlng": [
        22.9907,
        120.212
      ],
      "num": 2,
      "title": "台南神學院（府城大學）",
      "desc": "1876年巴克禮從打狗遷至台南府城，將旗後與府城兩地的「傳教師養成班」合併，命名為「大學」（Capital College），擔任首任校長。1880年2月23日台南神學院在新樓正式開學，共15名學生。這是台灣第一所西式高等教育學府，校舍為國定古蹟，也是電視劇《一把青》拍攝場景。巴克禮在此任教數十年，培育無數台灣本土傳道人。",
      "photo": "/stories/taiwan-missionaries/spot-photos/f52907b0a4c5c023.jpg",
      "iconId": "default",
      "cardOffset": {
        "x": -120,
        "y": -55
      }
    },
    {
      "id": "s3",
      "latlng": [
        22.9893,
        120.2135
      ],
      "num": 3,
      "title": "新樓醫院（新樓醫館）",
      "desc": "新樓醫院前身為1865年馬雅各醫生創立的看西街醫館，1900年遷至現址並命名「新樓醫院」，是台灣最早的西式醫院之一。巴克禮於1884年借用新樓醫院東北角的房間設立印刷機房，創辦「聚珍堂」（新樓書房），引進台灣第一套現代活版印刷設備。1885年7月12日，《台灣府城教會報》在此創刊，是遠東地區第一份教會報紙，以白話字（台語羅馬字）印行。\n\n📷 新樓醫院（新樓醫館）, Chloekwok020910 (CC BY 4.0)",
      "photo": "/stories/taiwan-missionaries/spot-photos/9af6a947a2bb89aa.jpg",
      "iconId": "default",
      "cardOffset": {
        "x": 100,
        "y": -65
      }
    },
    {
      "id": "s4",
      "latlng": [
        22.9918,
        120.207
      ],
      "num": 4,
      "title": "太平境馬雅各紀念教會",
      "desc": "位於台南市公園路6號，是台灣最早的基督教會之一，由馬雅各醫師於1865年創立。巴克禮長期在此牧會，教會留有巴克禮與信徒在門前的歷史合照。現今的白色典雅教堂建於1951年重建，內設管風琴。巴克禮在太平境教會推動白話字教育，教導信徒以台語羅馬字讀寫，使不識漢字的平民也能閱讀聖經，對台灣基層識字率提升貢獻卓著。",
      "photo": "/stories/taiwan-missionaries/spot-photos/6292fd80f6e508f7.jpg",
      "iconId": "default",
      "cardOffset": {
        "x": -110,
        "y": -60
      }
    },
    {
      "id": "s5",
      "latlng": [
        22.9855,
        120.2075
      ],
      "num": 5,
      "title": "台灣府城小南門遺址",
      "desc": "1895年10月20日深夜，清軍潰散後台南城陷入混亂，五萬居民性命堪虞。台南仕紳懇請巴克禮與宋忠堅兩位牧師出面。他們手持英國旗與燈籠，由小南門出城，在黑夜中冒死穿越交戰區，前往二層行溪畔的日軍軍營與乃木希典交涉。翌日，日軍由小南門和平入城，台南府城免遭屠戮。巴克禮此舉保全了全城百姓，1897年獲明治天皇頒授五等旭日勳章。\n\n📷 臺灣府城小南門 pre-1945 photograph (PD)",
      "photo": "/stories/taiwan-missionaries/spot-photos/b5c07819f60f929a.jpg",
      "iconId": "default",
      "cardOffset": {
        "x": 95,
        "y": -70
      }
    },
    {
      "id": "s6",
      "latlng": [
        22.99,
        120.218
      ],
      "num": 6,
      "title": "東門巴克禮紀念教會",
      "desc": "位於東門路一段187號，起源於巴克禮牧師夫婦為新樓醫院與神學院工作人員所辦的聚會。最初借用神學院教師宿舍，三年後成為太平境教會東門支會，1921年升格為堂會。1954年為紀念巴克禮牧師對台灣教育與文化的貢獻，正式更名為「東門巴克禮紀念教會」。教會內設有歷史資料館，保存了巴克禮生平文物與早期白話字文獻。\n\n📷 東門巴克禮紀念教會, 阿道 (CC BY-SA 4.0)",
      "photo": "/stories/taiwan-missionaries/spot-photos/933201e53fd0c6e9.jpg",
      "iconId": "default",
      "cardOffset": {
        "x": -115,
        "y": -55
      }
    },
    {
      "id": "s7",
      "latlng": [
        22.993,
        120.2234
      ],
      "num": 7,
      "title": "台灣教會公報社",
      "desc": "位於台南市青年路334號（1983年從神學院遷至現址）。巴克禮於1884年從英國引進現代製版印刷機，創辦「聚珍堂」，1885年發行《台灣府城教會報》（今《台灣教會公報》），是台灣歷史最悠久、持續發行至今的報紙。巴克禮以白話字排印，讓識字率低的時代也能傳播知識。公報社至今仍持續出版，是台灣基督長老教會的文化重鎮。\n\n📷 台灣教會公報社總社, Outlookxp (CC BY-SA 4.0)",
      "photo": "/stories/taiwan-missionaries/spot-photos/6fad0fae9d8d4e03.jpg",
      "iconId": "default",
      "cardOffset": {
        "x": 85,
        "y": -60
      }
    },
    {
      "id": "s8",
      "latlng": [
        22.9762,
        120.2293
      ],
      "num": 8,
      "title": "巴克禮紀念公園",
      "desc": "位於台南市東區中華東路三段，面積9.1公頃，被譽為「台南都市之肺」。公園原為荷蘭時期的古埤塘，園內「夢湖」水源來自古老的荷蘭埤。2004年為紀念巴克禮牧師對台南60年的奉獻而命名。園內大量落羽松冬季轉為橙紅，是台南市民最喜愛的休憩空間。巴克禮1935年10月5日病逝於台南，享年86歲，安葬於台南基督教墓園，一生奉獻台灣整整60年。",
      "photo": "/stories/taiwan-missionaries/spot-photos/50188679227a2518.jpg",
      "iconId": "default",
      "cardOffset": {
        "x": -100,
        "y": -65
      }
    },
    {
      "id": "s9",
      "latlng": [
        22.996,
        120.1968
      ],
      "num": 9,
      "title": "看西街醫館舊址",
      "desc": "位於台南市中西區仁愛街與西門路交叉口附近。1865年6月16日，馬雅各醫生在此開設台灣第一間西式醫館，是台灣醫療傳道的起點。巴克禮1876年由打狗遷居台南後，繼承並擴展了從看西街醫館發展而來的宣教網絡。看西街一帶是英國長老教會在南台灣宣教的發源地，巴克禮以此為根據地，將教育、醫療、印刷三大事業推展至全台南。\n\n📷 臺南看西街教會, 地下高雄 (CC BY-SA 4.0)",
      "photo": "/stories/taiwan-missionaries/spot-photos/d15cdf224f23e9e5.jpg",
      "iconId": "default",
      "cardOffset": {
        "x": 90,
        "y": -55
      }
    }
  ],
  "routes": [
    {
      "id": "r1",
      "name": "打狗至台南宣教之路",
      "pts": [
        [
          22.6126,
          120.2654
        ],
        [
          22.634,
          120.281
        ],
        [
          22.665,
          120.305
        ],
        [
          22.72,
          120.32
        ],
        [
          22.78,
          120.29
        ],
        [
          22.84,
          120.26
        ],
        [
          22.9,
          120.23
        ],
        [
          22.95,
          120.22
        ],
        [
          22.9762,
          120.2293
        ],
        [
          22.9855,
          120.2075
        ],
        [
          22.9893,
          120.2135
        ],
        [
          22.9907,
          120.212
        ],
        [
          22.9918,
          120.207
        ],
        [
          22.996,
          120.1968
        ]
      ],
      "color": "blue",
      "elevations": null
    },
    {
      "id": "r2",
      "name": "台南府城宣教據點巡禮",
      "pts": [
        [
          22.996,
          120.1968
        ],
        [
          22.9918,
          120.207
        ],
        [
          22.9907,
          120.212
        ],
        [
          22.9893,
          120.2135
        ],
        [
          22.99,
          120.218
        ],
        [
          22.993,
          120.2234
        ],
        [
          22.9855,
          120.2075
        ],
        [
          22.9762,
          120.2293
        ]
      ],
      "color": "orange",
      "elevations": null
    }
  ]
}