{
  "version": 4,
  "name": "鄭和下西洋 — 第七次下西洋",
  "center": [
    12,
    88
  ],
  "zoom": 4,
  "basemapId": "voyager",
  "spots": [
    {
      "id": "s1",
      "num": 1,
      "latlng": [
        32.10361,
        118.72528
      ],
      "title": "南京龍江寶船廠 (Longjiang Shipyard, Nanjing)",
      "desc": "宣德五年六月詔下後，龍江寶船廠為第七次下西洋整備大䌈二百餘艘，其中九桅寶船居首。鄭和於此總領船工、徵募官兵二萬七千五百餘員，為明代最末一次西洋遠航奠基。\n\n📷 鄭和像，約 1600 年刊本 (PD)",
      "photo": "/stories/zheng-he/spot-photos/43df97539044013f.jpg",
      "iconId": "pin",
      "cardOffset": {
        "x": 0,
        "y": -60
      }
    },
    {
      "id": "s2",
      "num": 2,
      "latlng": [
        31.49278,
        121.21806
      ],
      "title": "太倉劉家港 (Liujiagang, Taicang)",
      "desc": "宣德六年春，船隊集結於長江口太倉劉家港候風；鄭和於此重建天妃宮並立《通番事蹟碑》，追述前六次航程、祈求第七次平安。這是歷次下西洋傳統的啟碇錨地。\n\n📷 劉家港通番事蹟碑（鄭和 1431 年立）(CC BY-SA)",
      "photo": "/stories/zheng-he/spot-photos/2a00cef10779453d.jpg",
      "iconId": "pin",
      "cardOffset": {
        "x": 0,
        "y": -60
      }
    },
    {
      "id": "s3",
      "num": 3,
      "latlng": [
        25.9625,
        119.52361
      ],
      "title": "福建長樂太平港 (Changle Taiping Harbour)",
      "desc": "宣德六年冬，船隊南下駐泊長樂太平港候東北季風。鄭和於南山重修天妃宮並立《天妃靈應之記》碑，翌年正月祭畢開洋，這是寶船隊最後一次從中國本土出洋。\n\n📷 《天妃經》1420 版寶船卷首圖 (PD)",
      "photo": "/stories/zheng-he/spot-photos/4cc080dca67847ff.jpg",
      "iconId": "pin",
      "cardOffset": {
        "x": 0,
        "y": -60
      }
    },
    {
      "id": "s4",
      "num": 4,
      "latlng": [
        13.76667,
        109.21667
      ],
      "title": "占城新州港 (Champa, Qui Nhon)",
      "desc": "宣德七年正月船隊抵占城新州港，占城王遣使奉金葉表、象牙犀角朝貢。此為船隊渡南海後首個外邦停靠站，亦是歷次下西洋必經之地。\n\n📷 鄭和航海圖．蘇門答臘暹羅段（武備志 1628 茅坤本）(PD)",
      "photo": "/stories/zheng-he/spot-photos/02dd3af9953437c4.jpg",
      "iconId": "pin",
      "cardOffset": {
        "x": 0,
        "y": -60
      }
    },
    {
      "id": "s5",
      "num": 5,
      "latlng": [
        2.19583,
        102.24861
      ],
      "title": "滿剌加 (Malacca)",
      "desc": "二月抵滿剌加，在此設立官廠囤積貨物、修理船舶，作為西洋航段的中繼總站。滿剌加王室因明廷冊封脫離暹羅桎梏，一向對寶船隊最為親附。\n\n📷 鄭和航海圖．滿剌加段（武備志 1628）(PD)",
      "photo": "/stories/zheng-he/spot-photos/cf979f4b761edde2.jpg",
      "iconId": "pin",
      "cardOffset": {
        "x": 0,
        "y": -60
      }
    },
    {
      "id": "s6",
      "num": 6,
      "latlng": [
        5.17917,
        97.075
      ],
      "title": "蘇門答剌 (Samudera Pasai, Sumatra)",
      "desc": "六月船隊抵蘇門答剌北岸，為進入印度洋前最後的補給與分艦點。鄭和在此遣副使洪保率分艦隊遠赴天方（麥加），主力船隊則續航錫蘭、古里。\n\n📷 沈度《瑞應麒麟圖》，永樂十二年（1414）麻林進貢 (PD)",
      "photo": "/stories/zheng-he/spot-photos/5d9ceaf980ba0295.jpg",
      "iconId": "pin",
      "cardOffset": {
        "x": 0,
        "y": -60
      }
    },
    {
      "id": "s7",
      "num": 7,
      "latlng": [
        6.0268,
        80.217
      ],
      "title": "錫蘭山別羅里 (Ceylon / Galle)",
      "desc": "船隊循印度洋西航至錫蘭山南岸的別羅里港。此處為鄭和第二次下西洋時所立《布施錫蘭山佛寺碑》的故地，漢、泰米爾、波斯三語並列，見證寶船隊宗教並祀之風。\n\n📷 鄭和航海圖．錫蘭與非洲段（武備志 1628）(PD)",
      "photo": "/stories/zheng-he/spot-photos/0093f20523f6396c.jpg",
      "iconId": "pin",
      "cardOffset": {
        "x": 0,
        "y": -60
      }
    },
    {
      "id": "s8",
      "num": 8,
      "latlng": [
        11.2588,
        75.7804
      ],
      "title": "古里 (Calicut, modern Kozhikode)",
      "desc": "古里為歷次下西洋的西洋總會，也是鄭和最鍾愛的海外據點。宣德八年（1433）三月，鄭和在此次回航途中卒於古里，享年六十二；王景弘代領船隊扶柩東返，衣冠葬於南京牛首山。\n\n📷 鄭和航海圖．印度與非洲段（武備志 1628）(PD)",
      "photo": "/stories/zheng-he/spot-photos/7f93280823f94162.jpg",
      "iconId": "pin",
      "cardOffset": {
        "x": 0,
        "y": -60
      }
    },
    {
      "id": "s9",
      "num": 9,
      "latlng": [
        27.09444,
        56.45306
      ],
      "title": "忽魯謨斯 (Hormuz)",
      "desc": "寶船主隊續航至波斯灣口的忽魯謨斯，此為第七次下西洋主力艦隊的最西停靠。忽魯謨斯王遣使隨船回朝，獻獅子、麒麟、西馬、金錢豹等奇獸珍寶。\n\n📷 《天妃經》卷首鄭和下西洋圖（1420 年版摹本）(PD)",
      "photo": "/stories/zheng-he/spot-photos/655ff04c68041006.jpg",
      "iconId": "pin",
      "cardOffset": {
        "x": 0,
        "y": -60
      }
    },
    {
      "id": "s10",
      "num": 10,
      "latlng": [
        21.4225,
        39.8262
      ],
      "title": "天方 (Mecca, via Jeddah)",
      "desc": "洪保率分艦隊自蘇門答剌西渡，經阿丹入紅海抵天方；七人小隊陸行朝覲麥加，購麒麟、獅子、駝雞東返，為鄭和船隊足跡所至最西的點。\n\n📷 沈度《瑞應麒麟圖》(PD，代表分艦隊遠取異獸)",
      "photo": "/stories/zheng-he/spot-photos/5d9ceaf980ba0295.jpg",
      "iconId": "pin",
      "cardOffset": {
        "x": 0,
        "y": -60
      }
    },
    {
      "id": "s11",
      "num": 11,
      "latlng": [
        -3.2175,
        40.1167
      ],
      "title": "麻林地 (Malindi, Kenya)",
      "desc": "鄭和船隊在歷次航行中最遠抵達東非麻林地；麻林國於永樂十三年獻麒麟（長頸鹿），翰林沈度繪《瑞應麒麟圖》以紀。第七次航程仍派分艦巡歷非洲東岸，維繫朝貢體系。\n\n📷 鄭和航海圖．非洲段（武備志 1628）(PD，同錫蘭段切片)",
      "photo": "/stories/zheng-he/spot-photos/0093f20523f6396c.jpg",
      "iconId": "pin",
      "cardOffset": {
        "x": 0,
        "y": -60
      }
    }
  ],
  "routes": [
    {
      "id": "r1",
      "name": "鄭和下西洋 — 第七次下西洋",
      "color": "blue",
      "pts": [
        [
          32.10361,
          118.72528
        ],
        [
          31.49278,
          121.21806
        ],
        [
          25.9625,
          119.52361
        ],
        [
          13.76667,
          109.21667
        ],
        [
          2.19583,
          102.24861
        ],
        [
          5.17917,
          97.075
        ],
        [
          6.0268,
          80.217
        ],
        [
          11.2588,
          75.7804
        ],
        [
          27.09444,
          56.45306
        ],
        [
          21.4225,
          39.8262
        ],
        [
          -3.2175,
          40.1167
        ]
      ],
      "elevations": null
    }
  ],
  "overlay": {
    "id": "ming_1582",
    "opacity": 0.6
  }
}