{
  "version": 2,
  "name": "阿朗壹古道（旭海→南田）",
  "center": [
    22.245251041541813,
    120.89750289916994
  ],
  "zoom": 14,
  "spots": [
    {
      "id": "s1",
      "latlng": [
        22.2565,
        120.8822
      ],
      "num": 1,
      "title": "旭海安檢所",
      "desc": "起點，需先申請入山許可",
      "photo": null,
      "iconId": "info",
      "cardOffset": {
        "x": -137,
        "y": -50
      }
    },
    {
      "id": "s2",
      "latlng": [
        22.2445,
        120.8912
      ],
      "num": 2,
      "title": "觀音鼻制高點",
      "desc": "全程最高 120m，最佳海景展望點",
      "photo": "/examples/routes/spot-photos/e62bdcc422596998.jpg",
      "iconId": "sun",
      "cardOffset": {
        "x": 116,
        "y": -265
      }
    },
    {
      "id": "s3",
      "latlng": [
        22.2398,
        120.8958
      ],
      "num": 3,
      "title": "軍艦岩",
      "desc": "巨石延伸入海的壯觀地標",
      "photo": null,
      "iconId": "rock",
      "cardOffset": {
        "x": -160,
        "y": -19
      }
    },
    {
      "id": "s4",
      "latlng": [
        22.2372,
        120.8968
      ],
      "num": 4,
      "title": "南田石海灘",
      "desc": "圓潤美麗的南田石，禁止撿拾",
      "photo": null,
      "iconId": "water",
      "cardOffset": {
        "x": -125,
        "y": 55
      }
    },
    {
      "id": "s5",
      "latlng": [
        22.2428,
        120.8956
      ],
      "num": 5,
      "title": "南田端出口",
      "desc": "台26線 88.6K，古道終點",
      "photo": null,
      "iconId": "pin",
      "cardOffset": {
        "x": 173,
        "y": 29
      }
    }
  ],
  "routes": [
    {
      "id": "r1",
      "name": "阿朗壹古道",
      "pts": [
        [
          22.2565,
          120.8822
        ],
        [
          22.2552,
          120.8835
        ],
        [
          22.253,
          120.8848
        ],
        [
          22.251,
          120.8862
        ],
        [
          22.2485,
          120.8878
        ],
        [
          22.2462,
          120.8895
        ],
        [
          22.2445,
          120.8912
        ],
        [
          22.2432,
          120.8928
        ],
        [
          22.2418,
          120.8942
        ],
        [
          22.2398,
          120.8958
        ],
        [
          22.2372,
          120.8968
        ],
        [
          22.2345,
          120.8975
        ],
        [
          22.2428,
          120.8956
        ]
      ],
      "color": "red",
      "elevations": [
        5,
        10,
        15,
        20,
        40,
        80,
        120,
        60,
        30,
        15,
        5,
        8,
        10
      ]
    }
  ]
}