{
  "version": 4,
  "name": "使徒保羅宣教路線 — 第二次宣教旅行",
  "center": [
    38.5,
    28
  ],
  "zoom": 5,
  "basemapId": "voyager",
  "spots": [
    {
      "id": "s1",
      "num": 1,
      "latlng": [
        36.2021,
        36.1604
      ],
      "title": "敘利亞的安提阿 (Antioch on the Orontes)",
      "desc": "保羅與巴拿巴為馬可的事起爭執後分道，保羅另揀選西拉從這裡的母會出發，展開第二次宣教旅行（徒15:36-41）。安提阿教會是向外邦宣教的差派基地，「門徒稱為基督徒是從安提阿起首」（徒11:26）。\n\n📷 Antioch Saint Pierre Church, Onur Volkan Hatem (CC BY-SA 2.5)",
      "photo": "/stories/paul/spot-photos/6a9b94780537db0d.jpg",
      "iconId": "pin",
      "cardOffset": {
        "x": 0,
        "y": -60
      },
      "scripture_refs": [
        "Acts 15:36-41",
        "Acts 11:26"
      ],
      "era": {
        "start": 49,
        "end": 52
      }
    },
    {
      "id": "s2",
      "num": 2,
      "latlng": [
        37.349,
        33.345
      ],
      "title": "特庇 (Derbe)",
      "desc": "保羅與西拉走陸路穿越敘利亞、基利家，越過托羅斯山的「西里西亞門」後先抵特庇，堅固第一次旅行時所建立的教會（徒16:1）。\n\n📷 E.J. Davis, Site of Derbe, 1879 (PD)",
      "photo": "/stories/paul/spot-photos/af33e61181fa8dd4.jpg",
      "iconId": "pin",
      "cardOffset": {
        "x": 0,
        "y": -60
      },
      "scripture_refs": [
        "Acts 16:1"
      ],
      "era": {
        "start": 49,
        "end": 52
      }
    },
    {
      "id": "s3",
      "num": 3,
      "latlng": [
        37.5833,
        32.45
      ],
      "title": "路司得 (Lystra)",
      "desc": "少年提摩太在此加入宣教團，保羅為讓他顧及猶太同工便給他行割禮（徒16:1-3）。保羅第一次旅行時曾在此被石頭打至昏死，此番再訪交出新傳人。\n\n📷 Raphael, The Sacrifice at Lystra, 1515 (PD, V&A)",
      "photo": "/stories/paul/spot-photos/8f65ecf22a827797.jpg",
      "iconId": "pin",
      "cardOffset": {
        "x": 0,
        "y": -60
      },
      "scripture_refs": [
        "Acts 16:1-5"
      ],
      "era": {
        "start": 49,
        "end": 52
      }
    },
    {
      "id": "s4",
      "num": 4,
      "latlng": [
        39.7547,
        26.1589
      ],
      "title": "特羅亞 (Troas)",
      "desc": "聖靈兩次攔阻保羅往亞西亞和庇推尼後，他在特羅亞港夜間見異象——一個馬其頓人呼求「請你過來幫助我們」（徒16:9-10）。這是福音首次被引進歐洲的轉捩點，路加也從此加入（「我們」敘事開始）。\n\n📷 Alexandria Troas Roman baths, Elelicht (CC BY-SA 3.0)",
      "photo": "/stories/paul/spot-photos/7ebe5d7f59fa8f62.jpg",
      "iconId": "pin",
      "cardOffset": {
        "x": 0,
        "y": -60
      },
      "scripture_refs": [
        "Acts 16:6-10"
      ],
      "era": {
        "start": 49,
        "end": 52
      }
    },
    {
      "id": "s5",
      "num": 5,
      "latlng": [
        40.9356,
        24.4129
      ],
      "title": "尼亞波利 (Neapolis)",
      "desc": "保羅一行從特羅亞開船，經撒摩特喇，次日抵馬其頓的門戶港尼亞波利（今卡瓦拉），福音的腳蹤自此踏上歐洲大陸（徒16:11）。\n\n📷 View of Kavala from ancient Via Egnatia, Xristoupolitis (CC BY-SA 4.0)",
      "photo": "/stories/paul/spot-photos/95b3f3e243728601.jpg",
      "iconId": "pin",
      "cardOffset": {
        "x": 0,
        "y": -60
      },
      "scripture_refs": [
        "Acts 16:11"
      ],
      "era": {
        "start": 49,
        "end": 52
      }
    },
    {
      "id": "s6",
      "num": 6,
      "latlng": [
        41.0131,
        24.287
      ],
      "title": "腓立比 (Philippi)",
      "desc": "賣紫色布的呂底亞在河邊禱告處信主，全家受洗，歐洲第一間家庭教會在此誕生（徒16:13-15）。保羅趕出使女身上的鬼靈後與西拉被下監，半夜禱告唱詩時地震震開監門，禁卒全家歸主（徒16:25-34）。\n\n📷 Rembrandt, Paulus im Gefängnis, 1627 (PD, Staatsgalerie Stuttgart)",
      "photo": "/stories/paul/spot-photos/64abc67857ef9bb9.jpg",
      "iconId": "pin",
      "cardOffset": {
        "x": 0,
        "y": -60
      },
      "scripture_refs": [
        "Acts 16:12-40"
      ],
      "era": {
        "start": 49,
        "end": 52
      }
    },
    {
      "id": "s7",
      "num": 7,
      "latlng": [
        40.6401,
        22.9444
      ],
      "title": "帖撒羅尼迦 (Thessalonica)",
      "desc": "保羅沿羅馬大道 Via Egnatia 來到馬其頓省會，連三個安息日在會堂辯論，信者甚眾（徒17:1-4）。反對的猶太人煽動市民圍攻耶孫的家，弟兄們連夜送保羅離開。\n\n📷 Rotunda of Thessaloniki, Iolchos07 (CC BY-SA 4.0)",
      "photo": "/stories/paul/spot-photos/84ccf1e107d8c9e3.jpg",
      "iconId": "pin",
      "cardOffset": {
        "x": 0,
        "y": -60
      },
      "scripture_refs": [
        "Acts 17:1-9"
      ],
      "era": {
        "start": 49,
        "end": 52
      }
    },
    {
      "id": "s8",
      "num": 8,
      "latlng": [
        40.5244,
        22.2014
      ],
      "title": "庇哩亞 (Berea)",
      "desc": "庇哩亞人聽道比帖撒羅尼迦人更「賢於」，天天考查聖經驗證保羅所傳的（徒17:10-12）。帖撒羅尼迦的敵對者追來煽動群眾，弟兄們便送保羅到海邊往雅典。\n\n📷 St Paul's Tribune in Veria/Berea, Edal Anton Lefterov (CC BY-SA 3.0)",
      "photo": "/stories/paul/spot-photos/f77b517ef71b46c2.jpg",
      "iconId": "pin",
      "cardOffset": {
        "x": 0,
        "y": -60
      },
      "scripture_refs": [
        "Acts 17:10-15"
      ],
      "era": {
        "start": 49,
        "end": 52
      }
    },
    {
      "id": "s9",
      "num": 9,
      "latlng": [
        37.9715,
        23.7267
      ],
      "title": "雅典 (Athens)",
      "desc": "保羅見滿城偶像，心裡著急，就在會堂與市集辯論，被請上亞略巴古向希臘哲學家講論「未識之神」，引用他們的詩人，宣告獨一真神與復活（徒17:16-34）。丟尼修與婦人大馬哩等人信主。\n\n📷 Raphael, St Paul Preaching in Athens, 1515 (PD, V&A)",
      "photo": "/stories/paul/spot-photos/b3068bf170b58110.jpg",
      "iconId": "pin",
      "cardOffset": {
        "x": 0,
        "y": -60
      },
      "scripture_refs": [
        "Acts 17:16-34"
      ],
      "era": {
        "start": 49,
        "end": 52
      }
    },
    {
      "id": "s10",
      "num": 10,
      "latlng": [
        37.9061,
        22.8782
      ],
      "title": "哥林多 (Corinth)",
      "desc": "保羅在此住滿一年六個月，與製帳棚的亞居拉和百基拉同住同工，安息日在會堂勸化人（徒18:1-11）。主夜間異象說「有許多百姓是我的人」，哥林多教會從此建立；方伯迦流拒絕受理猶太人的控告。\n\n📷 Temple of Apollo, Corinth, Ixnay (PD)",
      "photo": "/stories/paul/spot-photos/ec51d30faec3bcdd.jpg",
      "iconId": "pin",
      "cardOffset": {
        "x": 0,
        "y": -60
      },
      "scripture_refs": [
        "Acts 18:1-18"
      ],
      "era": {
        "start": 49,
        "end": 52
      }
    },
    {
      "id": "s11",
      "num": 11,
      "latlng": [
        37.9395,
        27.3417
      ],
      "title": "以弗所 (Ephesus)",
      "desc": "保羅帶亞居拉、百基拉從堅革哩開航，短暫停靠以弗所進會堂辯論；眾人請他多住，他辭別說「神若許我，我還要回到你們這裡」（徒18:19-21），留下夫婦二人繼續牧養。\n\n📷 Library of Celsus façade, Ephesus, Benh LIEU SONG (CC BY-SA 3.0)",
      "photo": "/stories/paul/spot-photos/e53c421f505d106c.jpg",
      "iconId": "pin",
      "cardOffset": {
        "x": 0,
        "y": -60
      },
      "scripture_refs": [
        "Acts 18:18-21"
      ],
      "era": {
        "start": 49,
        "end": 52
      }
    },
    {
      "id": "s12",
      "num": 12,
      "latlng": [
        31.7781,
        35.2353
      ],
      "title": "耶路撒冷與安提阿歸航 (Jerusalem & Antioch)",
      "desc": "保羅在該撒利亞上岸後，上耶路撒冷問教會安，再下到安提阿總會述職，第二次宣教旅行圓滿結束（徒18:22）。全程約三千英里、歷時近三年，福音自此在歐洲生根。\n\n📷 Jerusalem Old City & Temple Mount, Avraham Graicer (CC BY-SA 4.0)",
      "photo": "/stories/paul/spot-photos/d557bc3b3a960b3e.jpg",
      "iconId": "pin",
      "cardOffset": {
        "x": 0,
        "y": -60
      },
      "scripture_refs": [
        "Acts 18:22"
      ],
      "era": {
        "start": 49,
        "end": 52
      }
    }
  ],
  "routes": [
    {
      "id": "r1",
      "name": "使徒保羅宣教路線 — 第二次宣教旅行",
      "color": "red",
      "pts": [
        [
          36.2021,
          36.1604
        ],
        [
          37.349,
          33.345
        ],
        [
          37.5833,
          32.45
        ],
        [
          39.7547,
          26.1589
        ],
        [
          40.9356,
          24.4129
        ],
        [
          41.0131,
          24.287
        ],
        [
          40.6401,
          22.9444
        ],
        [
          40.5244,
          22.2014
        ],
        [
          37.9715,
          23.7267
        ],
        [
          37.9061,
          22.8782
        ],
        [
          37.9395,
          27.3417
        ],
        [
          31.7781,
          35.2353
        ]
      ],
      "elevations": null
    }
  ],
  "overlay": {
    "id": "rome_200",
    "opacity": 0.6
  }
}