{
  "version": 4,
  "name": "張騫通西域 — 張騫首使西域",
  "center": [
    38.5,
    88
  ],
  "zoom": 4,
  "basemapId": "voyager",
  "overlay": {
    "id": "han_bc7",
    "opacity": 0.7
  },
  "spots": [
    {
      "id": "s1",
      "num": 1,
      "latlng": [
        34.22,
        108.95
      ],
      "title": "長安出使 (Chang'an, 西安)",
      "desc": "建元二年（BC 139），漢武帝為聯合西遷的大月氏夾擊匈奴，募能使外國者。郎官張騫應募，以匈奴堂邑父甘父為嚮導，率百餘人自長安出發。武帝親授漢節，使團由隴西西行進入匈奴勢力範圍。\n\n📷 ZhangQianTravels.jpg，莫高窟第 323 窟〈張騫出使西域圖〉（公有領域，初唐壁畫）",
      "photo": "/stories/zhang-qian/spot-photos/742e07e27b436b76.jpg",
      "iconId": "pin",
      "cardOffset": {
        "x": 0,
        "y": -60
      },
      "historical_refs": [
        "《史記·大宛列傳》",
        "《漢書·張騫李廣利傳》"
      ],
      "era": {
        "start": -138,
        "end": -126
      }
    },
    {
      "id": "s2",
      "num": 2,
      "latlng": [
        37.5,
        102
      ],
      "title": "河西走廊被俘 (隴西河西)",
      "desc": "使團才出隴西、行經河西走廊（今武威、張掖一帶），即被匈奴騎兵發現俘獲，盡數押送單于王庭。此時河西尚屬匈奴右賢王轄地，漢朝勢力未及。\n\n📷 Hexi Corridor.png，SY (CC BY-SA 4.0) — 河西走廊地理示意",
      "photo": "/stories/zhang-qian/spot-photos/5d484c59ab4ea4c4.jpg",
      "iconId": "pin",
      "cardOffset": {
        "x": 0,
        "y": -60
      },
      "historical_refs": [
        "《史記·大宛列傳》",
        "《漢書·張騫李廣利傳》"
      ],
      "era": {
        "start": -138,
        "end": -126
      }
    },
    {
      "id": "s3",
      "num": 3,
      "latlng": [
        40.8,
        111.7
      ],
      "title": "匈奴王庭扣留十年 (河套 / 漠南)",
      "desc": "軍臣單于怒曰「月氏在吾北，漢何以得往？」遂扣留張騫於王庭（今內蒙古呼和浩特一帶漠南），為其娶妻以絆其心。張騫居匈奴十餘年，生子，然「持漢節不失」，始終未忘使命。\n\n📷 Xiongnu warrior…Huo Qubing.jpg，西漢霍去病墓〈馬踏匈奴〉石刻（PD，公有領域）",
      "photo": "/stories/zhang-qian/spot-photos/6c128a9c2978a45f.jpg",
      "iconId": "pin",
      "cardOffset": {
        "x": 0,
        "y": -60
      },
      "historical_refs": [
        "《史記·大宛列傳》",
        "《漢書·匈奴傳》"
      ],
      "era": {
        "start": -138,
        "end": -126
      }
    },
    {
      "id": "s4",
      "num": 4,
      "latlng": [
        42.95,
        89.17
      ],
      "title": "脫匈奴西奔 (車師 / 吐魯番)",
      "desc": "單于看守稍懈，張騫率甘父等乘隙西遁，繞過天山東麓車師（今吐魯番盆地）。一行數十日，沿北道入西域，食物僅靠甘父善射獸充飢。\n\n📷 Yangguan Beacon Tower.jpg，N509FZ (CC BY-SA 4.0) — 陽關漢代烽燧遺址，漢使出西域必經之路",
      "photo": "/stories/zhang-qian/spot-photos/62713c6aa6013605.jpg",
      "iconId": "pin",
      "cardOffset": {
        "x": 0,
        "y": -60
      },
      "historical_refs": [
        "《史記·大宛列傳》"
      ],
      "era": {
        "start": -138,
        "end": -126
      }
    },
    {
      "id": "s5",
      "num": 5,
      "latlng": [
        40.4,
        72
      ],
      "title": "至大宛 (費爾干納)",
      "desc": "張騫抵大宛（今費爾干納盆地）。大宛王久聞漢富饒，欲通使未得其便，見張騫大喜，遣譯導送至康居。大宛出產「汗血馬」（汗出如血的天馬），張騫見之，後此馬種成為漢武帝最渴求的戰略資源。\n\n📷 Cult of Heavenly horse…Ferghana.jpg，大宛汗血馬青銅飾件 (CC BY-SA 4.0)",
      "photo": "/stories/zhang-qian/spot-photos/d009ac343432dabd.jpg",
      "iconId": "pin",
      "cardOffset": {
        "x": 0,
        "y": -60
      },
      "historical_refs": [
        "《史記·大宛列傳》",
        "《漢書·西域傳》"
      ],
      "era": {
        "start": -138,
        "end": -126
      }
    },
    {
      "id": "s6",
      "num": 6,
      "latlng": [
        41,
        69
      ],
      "title": "過康居 (錫爾河流域)",
      "desc": "自大宛北行，經康居（今錫爾河中下游，塔什干—奇姆肯特一帶）。康居為游牧國，時服匈奴又接月氏，遣使送張騫南下渡阿姆河至大月氏。\n\n📷 Bronze seal of a Xiongnu chief.jpg (CC BY-SA) — 游牧民族印信，反映康居等國的草原政治生態",
      "photo": "/stories/zhang-qian/spot-photos/9702d7eefcaddacf.jpg",
      "iconId": "pin",
      "cardOffset": {
        "x": 0,
        "y": -60
      },
      "historical_refs": [
        "《史記·大宛列傳》",
        "《漢書·西域傳》"
      ],
      "era": {
        "start": -138,
        "end": -126
      }
    },
    {
      "id": "s7",
      "num": 7,
      "latlng": [
        37,
        66
      ],
      "title": "終見大月氏 (阿姆河北岸)",
      "desc": "張騫終於抵達大月氏（今阿姆河北岸烏茲別克南部）。此時月氏已立新王，征服大夏而定居肥饒之地，「志安樂，又自以遠漢，殊無報胡之心」。張騫滯留年餘，遊說不成，復南下考察大夏。\n\n📷 Tillya tepe.jpg (CC BY-SA 2.0) — 阿富汗北部提拉丘地出土黃金器，大月氏—貴霜前身文化遺存",
      "photo": "/stories/zhang-qian/spot-photos/1840fc1dafa32fd5.jpg",
      "iconId": "pin",
      "cardOffset": {
        "x": 0,
        "y": -60
      },
      "historical_refs": [
        "《史記·大宛列傳》"
      ],
      "era": {
        "start": -138,
        "end": -126
      }
    },
    {
      "id": "s8",
      "num": 8,
      "latlng": [
        36.76,
        66.9
      ],
      "title": "考察大夏 (Bactria, 巴爾赫)",
      "desc": "張騫南渡阿姆河，入大夏（Bactria，今阿富汗北部巴爾赫一帶）。大夏「其俗土著，有城屋」，民善賈，為希臘化殘餘王國。張騫於大夏市場見邛竹杖、蜀布，推知有道可由身毒（印度）通蜀，回國後向武帝建議開西南夷道。\n\n📷 Tillya Tepe crown.jpg (CC BY-SA 2.0) — 大夏故地提拉丘地黃金冠，體現巴克特里亞多元工藝",
      "photo": "/stories/zhang-qian/spot-photos/a61713b12222af68.jpg",
      "iconId": "pin",
      "cardOffset": {
        "x": 0,
        "y": -60
      },
      "historical_refs": [
        "《史記·大宛列傳》",
        "《漢書·張騫李廣利傳》"
      ],
      "era": {
        "start": -138,
        "end": -126
      }
    },
    {
      "id": "s9",
      "num": 9,
      "latlng": [
        34,
        98
      ],
      "title": "歸程南道再被俘 (羌中)",
      "desc": "張騫欲避匈奴，改從南道沿崑崙山北麓、經羌中（今青海東部）東歸。不料羌人時服匈奴，張騫再次被俘送單于庭，扣留一年餘。\n\n📷 Zhangqianwest3.jpg，敦煌莫高窟 323 窟〈張騫西行圖〉（PD 公有領域）",
      "photo": "/stories/zhang-qian/spot-photos/2f7bf612aeaed63e.jpg",
      "iconId": "pin",
      "cardOffset": {
        "x": 0,
        "y": -60
      },
      "historical_refs": [
        "《史記·大宛列傳》"
      ],
      "era": {
        "start": -138,
        "end": -126
      }
    },
    {
      "id": "s10",
      "num": 10,
      "latlng": [
        47.9,
        106.9
      ],
      "title": "單于死亂乘隙逃歸 (漠北)",
      "desc": "元朔三年（BC 126），軍臣單于卒，其弟左谷蠡王伊稚斜自立，與太子於單爭位。匈奴內亂，張騫攜匈奴妻及甘父乘隙南逃，終於奔還漢境。\n\n📷 HanWudiBuddhas.jpg，莫高窟 323 窟 漢武帝禮佛圖（PD，與張騫出使同組壁畫）",
      "photo": "/stories/zhang-qian/spot-photos/46c792c8e7155ff5.jpg",
      "iconId": "pin",
      "cardOffset": {
        "x": 0,
        "y": -60
      },
      "historical_refs": [
        "《史記·匈奴列傳》",
        "《史記·大宛列傳》"
      ],
      "era": {
        "start": -138,
        "end": -126
      }
    },
    {
      "id": "s11",
      "num": 11,
      "latlng": [
        34.2205,
        108.95
      ],
      "title": "返長安覆命 (BC 126)",
      "desc": "元朔三年（BC 126），張騫與甘父回到長安，去時百餘人、歸時僅二人，歷時十三載。武帝拜為太中大夫，甘父為奉使君。張騫以親歷報告西域三十六國地理、物產、兵力，《史記》譽為「鑿空」——從此中原始知蔥嶺以西有國。\n\n📷 Statue of Zhang Qian.jpg，陝西歷史博物館藏張騫像（CC BY-SA）",
      "photo": "/stories/zhang-qian/spot-photos/8061fe039796486b.jpg",
      "iconId": "pin",
      "cardOffset": {
        "x": 0,
        "y": -60
      },
      "historical_refs": [
        "《史記·大宛列傳》",
        "《漢書·張騫李廣利傳》"
      ],
      "era": {
        "start": -138,
        "end": -126
      }
    },
    {
      "id": "s12",
      "num": 12,
      "latlng": [
        33.15,
        107.33
      ],
      "title": "身後歸葬故里 (漢中城固)",
      "desc": "元鼎三年（BC 114）張騫卒，歸葬漢中郡城固縣（今陝西城固博望鎮）。2014 年「絲綢之路：長安—天山廊道的路網」列入聯合國世界遺產，張騫墓為其中一處紀念性遺址。\n\n📷 張騫墓 Zhang Qian Tomb.jpg，hanming_huang (CC BY-SA 2.0) — 陝西城固張騫墓",
      "photo": "/stories/zhang-qian/spot-photos/a5a6da4cc7b9aa96.jpg",
      "iconId": "pin",
      "cardOffset": {
        "x": 0,
        "y": -60
      },
      "historical_refs": [
        "《漢書·張騫李廣利傳》",
        "《水經注·沔水》"
      ],
      "era": {
        "start": -138,
        "end": -126
      }
    }
  ],
  "routes": []
}
