{
  "version": 3,
  "name": "最後晚餐到各各他 — 受難週 (二)",
  "center": [
    31.7767,
    35.232
  ],
  "zoom": 15,
  "basemapId": "voyager",
  "spots": [
    {
      "id": "upper-room",
      "latlng": [
        31.7717,
        35.2291
      ],
      "num": 1,
      "title": "馬可樓 Upper Room",
      "desc": "耶穌與門徒在此吃逾越節的筵席。祂擘餅、分杯，設立聖餐：「這是我的身體，為你們捨的。」並為門徒洗腳，留下新命令：「你們要彼此相愛。」＊傳統地點為錫安山馬可樓。",
      "photo": "/stories/passion-week/spot-photos/109f115b3855881b.jpg",
      "iconId": "pin",
      "cardOffset": {
        "x": 0,
        "y": -60
      },
      "scripture_refs": [
        "Matt 26:20-29",
        "John 13:1-17",
        "Luke 22:19-20"
      ],
      "era": {
        "start": 30,
        "end": 30
      }
    },
    {
      "id": "gethsemane",
      "latlng": [
        31.7793,
        35.2397
      ],
      "num": 2,
      "title": "客西馬尼園 Gethsemane",
      "desc": "耶穌在此極其憂傷禱告：「父啊！你若願意，就把這杯撤去；然而不要成就我的意思，只要成就你的意思。」汗珠如大血點滴在地上。猶大以親嘴為記，出賣耶穌。\n\n📷 Andrea Mantegna《Agony in the Garden》c.1455 (PD, 作者 1506 歿，National Gallery London)",
      "photo": "/stories/passion-week/spot-photos/b66de17b8531f31e.jpg",
      "iconId": "pin",
      "cardOffset": {
        "x": 0,
        "y": -60
      },
      "scripture_refs": [
        "Matt 26:36-46",
        "Luke 22:39-46",
        "John 18:1-11"
      ],
      "era": {
        "start": 30,
        "end": 30
      }
    },
    {
      "id": "caiaphas",
      "latlng": [
        31.7714,
        35.229
      ],
      "num": 3,
      "title": "大祭司該亞法府 House of Caiaphas",
      "desc": "耶穌被帶到該亞法面前受審，公會假見證定祂為死罪。同時彼得在院中三次不認主——雞叫了，他出去痛哭。＊傳統地點為今雞鳴堂（St. Peter in Gallicantu）。",
      "photo": "/stories/passion-week/spot-photos/84f3332ef3554c47.jpg",
      "iconId": "pin",
      "cardOffset": {
        "x": 0,
        "y": -60
      },
      "scripture_refs": [
        "Matt 26:57-75",
        "Luke 22:54-62",
        "John 18:15-27"
      ],
      "era": {
        "start": 30,
        "end": 30
      }
    },
    {
      "id": "pilate",
      "latlng": [
        31.78,
        35.2345
      ],
      "num": 4,
      "title": "彼拉多審判 Pilate's Judgment",
      "desc": "猶太人將耶穌解到羅馬巡撫彼拉多面前。彼拉多查不出耶穌的罪，群眾卻高喊「釘他十字架」。彼拉多洗手推卸責任，將耶穌交出去釘十字架。",
      "photo": "/stories/passion-week/spot-photos/414cae04ad50e6db.jpg",
      "iconId": "pin",
      "cardOffset": {
        "x": 0,
        "y": -60
      },
      "scripture_refs": [
        "Matt 27:11-26",
        "John 18:28-19:16"
      ],
      "era": {
        "start": 30,
        "end": 30
      }
    },
    {
      "id": "via-dolorosa",
      "latlng": [
        31.7793,
        35.2331
      ],
      "num": 5,
      "title": "苦路 Via Dolorosa",
      "desc": "耶穌背負自己的十字架往各各他走去。路上古利奈人西門被強迫代背。婦女們為祂哀哭，耶穌說：「耶路撒冷的女子，不要為我哭，要為自己和自己的兒女哭。」",
      "photo": "/stories/passion-week/spot-photos/0e984460214637e1.jpg",
      "iconId": "pin",
      "cardOffset": {
        "x": 0,
        "y": -60
      },
      "scripture_refs": [
        "Matt 27:32",
        "Luke 23:26-31"
      ],
      "era": {
        "start": 30,
        "end": 30
      }
    },
    {
      "id": "golgotha",
      "latlng": [
        31.7784,
        35.2297
      ],
      "num": 6,
      "title": "各各他 Golgotha",
      "desc": "耶穌被釘在十字架上。祂為仇敵禱告：「父啊！赦免他們；因為他們所做的，他們不曉得。」對同釘強盜說：「今日你要同我在樂園裡了。」呼喊「成了！」，便氣絕了。＊傳統地點為聖墓教堂；學界另有園墓說。",
      "photo": "/stories/passion-week/spot-photos/8acf133f87be6b72.jpg",
      "iconId": "pin",
      "cardOffset": {
        "x": 0,
        "y": -60
      },
      "scripture_refs": [
        "Luke 23:33-46",
        "John 19:17-30"
      ],
      "era": {
        "start": 30,
        "end": 30
      }
    },
    {
      "id": "centurion",
      "latlng": [
        31.7785,
        35.2299
      ],
      "num": 7,
      "title": "百夫長認信 Centurion's Confession",
      "desc": "地大震動、聖殿裡的幔子從上到下裂為兩半。百夫長和一同看守耶穌的人見此情景，極其害怕，說：「這真是神的兒子了！」——第一個外邦人的信仰告白。\n\n📷 James Tissot《The Confession of the Centurion》c.1890 (PD, 作者 1902 歿，Brooklyn Museum)",
      "photo": "/stories/passion-week/spot-photos/2cb625fec1696be3.jpg",
      "iconId": "pin",
      "cardOffset": {
        "x": 0,
        "y": -60
      },
      "scripture_refs": [
        "Matt 27:51-54",
        "Mark 15:39"
      ],
      "era": {
        "start": 30,
        "end": 30
      }
    }
  ],
  "routes": [
    {
      "id": "r1",
      "name": "受難路線（最後晚餐到各各他）",
      "pts": [
        [
          31.7717,
          35.2291
        ],
        [
          31.7793,
          35.2397
        ],
        [
          31.7714,
          35.229
        ],
        [
          31.78,
          35.2345
        ],
        [
          31.7793,
          35.2331
        ],
        [
          31.7784,
          35.2297
        ],
        [
          31.7785,
          35.2299
        ]
      ],
      "color": "red",
      "elevations": null
    }
  ]
}