{
  "version": 3,
  "name": "復活與顯現 — 受難週 (三)",
  "center": [
    31.7786,
    35.238
  ],
  "zoom": 14,
  "basemapId": "voyager",
  "spots": [
    {
      "id": "tomb",
      "latlng": [
        31.779,
        35.2296
      ],
      "num": 1,
      "title": "亞利馬太約瑟的墓 Tomb of Joseph of Arimathea",
      "desc": "日落前亞利馬太的約瑟求得耶穌的身體，用細麻布裹好，安放在自己的新墳墓裡。封了大石頭，彼拉多派兵看守。第三日清晨，墳墓空了——「他不在這裡，照他所說的，已經復活了。」",
      "photo": "/stories/passion-week/spot-photos/5b046ac89c003440.jpg",
      "iconId": "pin",
      "cardOffset": {
        "x": 0,
        "y": -60
      },
      "scripture_refs": [
        "Matt 27:57-61",
        "Matt 28:5-7",
        "John 20:1-10"
      ],
      "era": {
        "start": 30,
        "end": 30
      }
    },
    {
      "id": "emmaus",
      "latlng": [
        31.8397,
        35.1019
      ],
      "num": 2,
      "title": "以馬忤斯路 Road to Emmaus",
      "desc": "復活日下午，兩個門徒往以馬忤斯去。耶穌與他們同行，從摩西和眾先知起，把聖經上指著自己的話都講解明白。進屋擘餅時，他們的眼睛才開了，認出是主——祂卻忽然不見了。\n\n📷 Rembrandt《Supper at Emmaus》1648 (PD, 作者 1669 歿，Louvre)",
      "photo": "/stories/passion-week/spot-photos/415fedcc46c135f3.jpg",
      "iconId": "pin",
      "cardOffset": {
        "x": 0,
        "y": -60
      },
      "scripture_refs": [
        "Luke 24:13-35"
      ],
      "era": {
        "start": 30,
        "end": 30
      }
    },
    {
      "id": "upper-room-appearance",
      "latlng": [
        31.7717,
        35.2291
      ],
      "num": 3,
      "title": "向門徒顯現 Appearance to the Disciples",
      "desc": "復活當晚耶穌站在門徒中間：「願你們平安！」將手和肋旁給他們看。多馬八日後才在場：「我的主，我的神！」耶穌說：「那沒有看見就信的有福了。」",
      "photo": "/stories/passion-week/spot-photos/c77afdb424588583.jpg",
      "iconId": "pin",
      "cardOffset": {
        "x": 0,
        "y": -60
      },
      "scripture_refs": [
        "John 20:19-29",
        "Luke 24:36-49"
      ],
      "era": {
        "start": 30,
        "end": 30
      }
    },
    {
      "id": "ascension",
      "latlng": [
        31.7784,
        35.2456
      ],
      "num": 4,
      "title": "橄欖山升天 Ascension",
      "desc": "耶穌領門徒到橄欖山，舉手給他們祝福，正祝福的時候離開他們，被取上升。門徒回耶路撒冷，天天在殿裡稱頌神。大使命：「你們要去，使萬民作我的門徒⋯⋯我就常與你們同在，直到世界的末了。」\n\n📷 Rembrandt《The Ascension of Christ》1636 (PD, 作者 1669 歿，Alte Pinakothek München)",
      "photo": "/stories/passion-week/spot-photos/27c2b98d93509929.jpg",
      "iconId": "pin",
      "cardOffset": {
        "x": 0,
        "y": -60
      },
      "scripture_refs": [
        "Matt 28:16-20",
        "Luke 24:50-53",
        "Acts 1:9-11"
      ],
      "era": {
        "start": 30,
        "end": 30
      }
    }
  ],
  "routes": [
    {
      "id": "r1",
      "name": "復活與顯現",
      "pts": [
        [
          31.779,
          35.2296
        ],
        [
          31.8397,
          35.1019
        ],
        [
          31.7717,
          35.2291
        ],
        [
          31.7784,
          35.2456
        ]
      ],
      "color": "green",
      "elevations": null
    }
  ]
}