{
  "version": 2,
  "name": "嘉明湖步道（天使的眼淚）",
  "center": [
    23.197962975291077,
    121.00075721740724
  ],
  "zoom": 14,
  "spots": [
    {
      "id": "s1",
      "latlng": [
        23.1875,
        121.012
      ],
      "num": 1,
      "title": "向陽登山口",
      "desc": "海拔 2,327m，南橫公路 154K",
      "photo": null,
      "iconId": "pin",
      "cardOffset": {
        "x": 172,
        "y": -97
      }
    },
    {
      "id": "s2",
      "latlng": [
        23.1942,
        121.0048
      ],
      "num": 2,
      "title": "向陽山屋",
      "desc": "可住 70 人，有水源，海拔 2,850m",
      "photo": null,
      "iconId": "rest",
      "cardOffset": {
        "x": -32,
        "y": 101
      }
    },
    {
      "id": "s3",
      "latlng": [
        23.1968,
        121.0025
      ],
      "num": 3,
      "title": "向陽名樹",
      "desc": "玉山圓柏，步道知名地標",
      "photo": null,
      "iconId": "tree",
      "cardOffset": {
        "x": 99,
        "y": -145
      }
    },
    {
      "id": "s4",
      "latlng": [
        23.2038,
        120.9962
      ],
      "num": 4,
      "title": "向陽山",
      "desc": "台灣百岳，海拔 3,603m",
      "photo": null,
      "iconId": "rock",
      "cardOffset": {
        "x": -82,
        "y": 85
      }
    },
    {
      "id": "s5",
      "latlng": [
        23.21,
        120.9895
      ],
      "num": 5,
      "title": "嘉明湖",
      "desc": "天使的眼淚，海拔 3,310m，台灣第二高高山湖泊",
      "photo": "/examples/routes/spot-photos/cb01fa9eb97af1a2.jpg",
      "iconId": "water",
      "cardOffset": {
        "x": -199,
        "y": -86
      }
    }
  ],
  "routes": [
    {
      "id": "r1",
      "name": "嘉明湖步道",
      "pts": [
        [
          23.1875,
          121.012
        ],
        [
          23.1895,
          121.0095
        ],
        [
          23.1918,
          121.0072
        ],
        [
          23.1942,
          121.0048
        ],
        [
          23.1968,
          121.0025
        ],
        [
          23.1995,
          121.0002
        ],
        [
          23.202,
          120.9978
        ],
        [
          23.2038,
          120.9962
        ],
        [
          23.2052,
          120.9945
        ],
        [
          23.2068,
          120.9928
        ],
        [
          23.2085,
          120.991
        ],
        [
          23.21,
          120.9895
        ]
      ],
      "color": "blue",
      "elevations": [
        2327,
        2500,
        2680,
        2850,
        3000,
        3200,
        3380,
        3603,
        3380,
        3400,
        3496,
        3310
      ]
    }
  ]
}