{
  "version": 3,
  "name": "榮耀進城 — 受難週 (一)",
  "center": [
    31.7767,
    35.2345
  ],
  "zoom": 15,
  "basemapId": "voyager",
  "spots": [
    {
      "id": "bethany",
      "latlng": [
        31.7714,
        35.2618
      ],
      "num": 1,
      "title": "伯大尼 Bethany",
      "desc": "耶穌和門徒從伯大尼出發前往耶路撒冷，展開受難週的旅程。此處是拉撒路、馬大、馬利亞的家鄉，耶穌最後一週多次夜宿於此。",
      "photo": "/stories/passion-week/spot-photos/ae1aea6cb15e9884.jpg",
      "iconId": "pin",
      "cardOffset": {
        "x": 0,
        "y": -60
      },
      "scripture_refs": [
        "Matt 21:1",
        "Mark 11:1",
        "John 12:1"
      ],
      "era": {
        "start": 30,
        "end": 30
      }
    },
    {
      "id": "mount-olives",
      "latlng": [
        31.7785,
        35.2436
      ],
      "num": 2,
      "title": "橄欖山下坡 Mount of Olives",
      "desc": "耶穌差派兩個門徒取來驢駒。從橄欖山西坡眺望聖殿山，全城在眼前展開——這裡是整個進城儀式最戲劇性的高點。",
      "photo": "/stories/passion-week/spot-photos/ae1aea6cb15e9884.jpg",
      "iconId": "pin",
      "cardOffset": {
        "x": 0,
        "y": -60
      },
      "scripture_refs": [
        "Matt 21:1-3",
        "Luke 19:28-40"
      ],
      "era": {
        "start": 30,
        "end": 30
      }
    },
    {
      "id": "triumphal-entry",
      "latlng": [
        31.7786,
        35.2364
      ],
      "num": 3,
      "title": "棕枝進城 Triumphal Entry",
      "desc": "群眾鋪衣服、砍棕樹枝在路上歡呼：「和散那！奉主名來的是應當稱頌的！」應驗撒迦利亞書「謙謙和和地騎著驢」的預言。",
      "photo": "/stories/passion-week/spot-photos/6b3cf4478d41c8f4.jpg",
      "iconId": "pin",
      "cardOffset": {
        "x": 0,
        "y": -60
      },
      "scripture_refs": [
        "Matt 21:8-11",
        "Zech 9:9",
        "John 12:13"
      ],
      "era": {
        "start": 30,
        "end": 30
      }
    },
    {
      "id": "temple-cleansing",
      "latlng": [
        31.7781,
        35.2354
      ],
      "num": 4,
      "title": "潔淨聖殿 Cleansing of the Temple",
      "desc": "耶穌推倒兌換銀錢之人的桌子，趕出做買賣的：「我的殿必稱為禱告的殿，你們倒使它成為賊窩了。」＊確切地點為今聖殿山外院一帶。",
      "photo": "/stories/passion-week/spot-photos/942443b6b7064bc6.jpg",
      "iconId": "pin",
      "cardOffset": {
        "x": 0,
        "y": -60
      },
      "scripture_refs": [
        "Matt 21:12-13",
        "Mark 11:15-17"
      ],
      "era": {
        "start": 30,
        "end": 30
      }
    },
    {
      "id": "widows-mite",
      "latlng": [
        31.7778,
        35.236
      ],
      "num": 5,
      "title": "寡婦的兩個小錢 Widow's Offering",
      "desc": "耶穌坐在聖殿庫房對面，看見一個窮寡婦投入兩個小錢。祂說：「這窮寡婦投入庫裡的比眾人所投的更多。」——最微小的奉獻，最完全的獻上。\n\n📷 James Tissot《The Widow’s Mite》c.1890 (PD, 作者 1902 歿，Brooklyn Museum)",
      "photo": "/stories/passion-week/spot-photos/4b8d1a942be68670.jpg",
      "iconId": "pin",
      "cardOffset": {
        "x": 0,
        "y": -60
      },
      "scripture_refs": [
        "Mark 12:41-44",
        "Luke 21:1-4"
      ],
      "era": {
        "start": 30,
        "end": 30
      }
    },
    {
      "id": "olivet-discourse",
      "latlng": [
        31.779,
        35.244
      ],
      "num": 6,
      "title": "橄欖山末世預言 Olivet Discourse",
      "desc": "門徒問：「這些事甚麼時候有？你降臨和世界的末了有甚麼預兆呢？」耶穌在橄欖山上講論末世、警醒等候、十個童女、才幹比喻與末日審判。",
      "photo": "/stories/passion-week/spot-photos/ae1aea6cb15e9884.jpg",
      "iconId": "pin",
      "cardOffset": {
        "x": 0,
        "y": -60
      },
      "scripture_refs": [
        "Matt 24:3",
        "Matt 25:31-46"
      ],
      "era": {
        "start": 30,
        "end": 30
      }
    }
  ],
  "routes": [
    {
      "id": "r1",
      "name": "進城路線",
      "pts": [
        [
          31.7714,
          35.2618
        ],
        [
          31.7785,
          35.2436
        ],
        [
          31.7786,
          35.2364
        ],
        [
          31.7781,
          35.2354
        ],
        [
          31.7778,
          35.236
        ],
        [
          31.779,
          35.244
        ]
      ],
      "color": "orange",
      "elevations": null
    }
  ]
}